1	Y N
0	P D E D A I N D A L N K V C S T G R R Q R S I C K Q L L K K
0	K F A Y P Q
0	G F G C P G N Q L K C N N H C K S I S C R A G Y C D A A T L W L R C T C T D C N G K K
1	M P
0	G P R G F
0	Y A V I T W R A L N K L
1	Y I
1	I Q K E D V P S E R Y
0	G V Y P H K
0	F H L D L L L V V G M G G V A A
1	L Q P
0	L E F N Q
0	V L I L T V P L R R L I L P L I F R
1	I P I Q Y
0	F L P F L A S L L S K V L
1	Q F A D G
1	M P P V D P N I E
1	H H M P
0	C I A K G N G C Q P S G V Q G N C C S G H C H K E P G W V A G Y C K
0	I V V A D L F S A G M V T T S T T L A W
1	G P G S P G G P L
0	K N G D G Y
1	Y G
1	F A L P Q
0	P L E S P G G T M A P Q
0	F L I G M T Q G L I C L I T R K C
0	P A L D S L T P A N E D Q K I G I E I I
1	N A
1	N F
0	N V T S I H S L L D E G K Q S L T K L A
0	G R R I T T R R I M E N G Q E
1	A I A V
0	V T P V Y Y I P L E A V
0	A T C D L L S M W N V N H S A C A A H C L L L G K S G G R C N D D A V C V C R K
1	S Y
1	V G
1	S P V V P F
0	K I Y P S F Q P Q P L I Y P
1	L V S G M
1	T D
0	L S R G Q
1	M W P V D P N I E
0	T P R V F
1	C K D D Q N P H S S
0	L H L W L P
0	N A G F N S N R A N S S R S S
1	W L A H K A L C S E K L D Q
1	M M P V D P N I E
0	L D A Q S A P L R
0	R E L E E
1	N A V P I T P T L N R
0	F A L P Q Y
1	L T D V E N L H L P L P L
0	R A D H P
0	L V Y P F P
0	F F S L L P S L I G G L V S A I K
0	L W Y Y I A L K K L R K A F P N K Y V K M
0	Y A E E R Y P I L
1	W A
0	G F G K A F H S V S N F A K K H K T A
1	Y A
0	V K H W P W
1	V I
0	T S Q D G N N H Q F T
0	R S I K G F
0	Y I S P Y F I N T S K G Q K C E F Q D A
0	M P F P K Y P V Q P F
0	E S S P N T Q W E L R A F M A
1	L Y Q E P V L G P
0	T R N L M G V S E L L I S T A
1	M Y P V D P N I E
1	P P G P T G P R G Q P G N I G F
1	F A Q T Q
1	V V Y P W
1	H T
1	L T Q T P V V V P P F
0	E S V F S K I G N A V G P A A Y W I L K G L G N M S D V N Q A D R I N R K K H
1	H K E M P F P K Y P V E P
1	W Q
1	M Q P V D P N I E
0	Y H G Q R H S D E H H H D D S L P H P Q
0	E R A N L R P C E Q H L M Q K I Q R D E
1	V R G P F P
1	F L Q P
1	L P P
1	P K
1	T Q
1	T P V V V P P F L Q P E
1	W R L
0	V A K V N I K P L E D K I L V
0	V Y P F P G P I
1	V Y P F P G P I P N S L P Q N I P P L T Q T P
0	G I A C G E S C V F L G C F I P G C S C K S K V C Y F N
0	M H T D D
0	R A D H F L
0	P S W G L A R V G S K K P G G T T Y Y Y
0	Q L K S P G V T L R P D V Y G
0	V F E W A F A R
0	D V F V I R E P F I S C S H L E
0	T S R N N P F Y F P S R R F S T R Y G N
0	Y G S L P Q K S Q R S Q D E N P V V H F F
0	Q A E Q S L I V L E S D K A S M E I
0	E S K H G L T N T A S H T R L S C D
1	E M P F P K Y P
0	W V P S K K C H L T N I A C L
1	F A G D D A P R A
1	N T
1	F A
0	D R V Y I H P F H L
0	A R P S R
1	A T
1	S K
0	F L A T C I N G V C W T V Y H G A G
1	L S E R R M L L R K E K Q A Q
1	L G P V R G P F P
0	Y N H N N L L T K F L S T G M V F E
1	N E
0	S K V Y P
0	C L L C A Y S I E F G T N I S K
1	L P T E V
1	I S Q E T
1	L I
1	Y I N Q M P Q K S R E A
0	G G R P T Y
1	I H P F A Q T Q
1	L P V P Q
0	K R F K Q D G G A S H A S P A S S
1	I P P L T Q T P V
0	P G T R I N Q E T V S L D A N G V S G S
0	L N E N L L R F F V A P F P E V F G
1	K V
1	T I
1	M Q
1	T N
1	E M P F P K Y P V E P
1	G P A V
1	K V S V V A L
1	N D
0	K H L P L P
0	S T H G V W
1	N Y
1	M G
0	Y I P I Q Y V L S R
0	L A N V S T
1	I P P L T Q T
0	V L A Q Y K
1	L Q A F E P L R
0	V P G E I V E S L S
0	W N I N A
1	L E Q L L R
0	V H L P P
1	P A C G G F W I S G R P G
1	W R M
0	C Q S Q L E R A N L R P C E Q H L M Q K
1	I Q
1	M K
1	E P M I G V N Q E L A Y
0	K L Q K T Y S Q Y K V Q Y D M
1	Q P H Q P L P P T V M F P P Q S V
1	A S
1	Y D
0	G V E N G V K Y W L I A N S W N E G W G
1	L K A L P M H
0	D Y I I D H V D Q H N A T E I
1	G G P A G P A V
1	W I
0	N R L T P E E I E R M V N D A E K F A E
1	W R Q
0	L I S T A V Q G I L F A L L G A
0	A T C Y C R T G R C A T R E S L S G V C E I S G R L Y R L C C R
1	P N
0	P P E Q P F H S Y G V T Y T F A T D A
1	Y P V E P F T
1	F Q S E E Q Q Q T E D E L Q D K I H P
1	E P M I G V N Q E L A Y F
0	I D W K K L L D A A K Q I L
1	R R D Y
1	V F
1	L T D V E N
1	L A P S L P G K P K P D
1	M F P V D P N I E
1	L P Q N I P P L
1	H Y
1	W D
0	D I E L L K K I L A G G F I Q K Y D S V M Q
0	A L A P E
1	V E
1	F F S D K
1	H P I N H R
0	A F P P P N V P G P R F P P P N F P G P R F P P P N F P G P R F P P P N F P G P R F P P P N F P G P P F P P P I F P G P W F P P P P P F R P P P F G P P R F P
1	I V Q N N D S T E Y G L F
1	Y A K P A A V R
1	L K P T P E G D L E I L
1	I P M
1	W R S
0	D L R F L Y P R G K L P V P T L P P F N P K P I Y I D M G N R Y
1	P P L T Q T P V V V P P F L Q P E
1	F P E V F G K E
0	K H L L A T S P K L A K Y L S
1	Y P S Y G L N Y
0	S S K R G R Q T P V L Y A M L D H S R S
0	V A G Y S Y T D A N K
1	T S
1	L L A P
1	S F
0	S F E Y F P S H F F V P E L E V T I I C
0	K R H R K V L R D N I Q G I T K P A I R R L A R
0	S V P G V N P N N A A A L P G K
1	W R K
0	V S K V K E T
0	R S L T P C T C G S S D L Y L V T R
1	M E P V D P N I E
0	T T M L I Q D E D D L E M A
1	L V
1	R L L L K L R Q
0	A Q A A V V R F Q E A A N K Q K Q E L D
0	E N T I K I Q E G S G L S K E E
1	W C K D D Q N P H S
1	K A
1	H I
0	S T G F Y L C T A R S S L G S
1	R P K
0	R A D H R Y N D L G H R
0	Q A P L K F H F G L N L K L Y Q W I L
0	K G T G N K N K I T I T N D Q N R L T P
0	A P S A K
0	F V A P F P E V F G
0	L N E C Q
0	D E E N G L D E Y D E V P M P V
1	P P F L Q P E
0	P L T Q T P
0	N F G S Q R F S K I A S N T Q S
1	A L G G A
1	L G P V R G P F P I
1	Y P Y
0	K C E F Q D A Y V L L S E K K
1	K R
1	I L D K V G I N Y
1	M N
1	R W
0	S A Y L A H R N Q S L D L A E Q E L V D C A S
1	F F V A P F P E V F G K
1	Y A K P A
1	R L
0	T N G I I R
0	G L P T C G E T C T L G T C Y V P D C S C S W P I C M K N
1	L S F N P T Q L E E Q
1	G P G A
1	A L K
1	V Y P F P G P I P N S L P Q N I P P
1	I L D K E G I D Y
0	S D K T I D G R G V K V
0	S K D Q F E F A L T A V A E E V N A I L K A
1	I P P L T Q T P V V V P P F L Q P E V
1	T P V V V P P F L Q P E V M
0	V L D C D G S G S N S G V I K G M E W A
1	E P M I G V
1	L P G E R G R P G A P G P
1	V F R E L K D L K G
0	T R P Y R Y P R V C D A S L S
0	E A G F A K L A A S D S K S L
1	L I A P
1	G P V G P A G N P G A N G L N
1	Y P E L F R
0	L H G P Y P
0	E L L A I T T V V G N Q
0	G Q E Y T F Y V I V T P Y A K
0	T G P I P N S L P Q
1	V A
1	G P A
1	Q F
0	S D P V L T P V Q S A G
0	Q T D E I K N D N I Q T D E I K N D N I
0	R W R Q I F N M V G F R N A V
1	V N
0	V D V S E G D I V I Y S K Y G
1	Q P L P P T V M F P P Q
1	D Q
1	M M
0	V A P F P E V
0	F L P V I A G V A A K F L P K I F C A I T K K C
1	L L Q
0	E Y L N K I Q N S L S T E W S P C S V T
0	G F G S L L G K A L R L G A N V L
1	Q N P H S S N I C N
1	M L
0	H V I E V Q Q I N S E R S W F F
0	A G L L G V V S T V L L G G V
1	T P E V D D E A L E K
0	N I I P A
1	P P L T Q T P V V V P P F L Q P E V
1	M A P T S S S T K K T Q L
1	N G
0	A N G I L N V S A V D K S T G
1	H F
0	P Y Y L S D I T D A L S P Q V
0	E R G D T
1	L P Q
0	Y F V G K M Y F N L I D
0	E A D E P L W L Y K G D N I E R A P T T A D H P I L P S I I D D V K L D P N R R Y A
1	T K
0	P E K P A P A P E T P A P E A
0	L V Q G S
0	G V G A G Y
0	F A K I I A K I A K I A K K I L
0	E E Y L I L S A R D V L A V V S K
1	L R E N N K L M L L E L K
0	Q P G P T
0	G A A E L P C S A D W W
1	Q V
1	M F
0	E R T Y L V N D K A A K M H A
0	V N N L A R T T P D R Q A A C
0	G L F D I V K K I A G H I V S S I
1	V A P F P E
0	D A Y P S G A W Y Y V P L G T Q Y T
1	Q G
0	A S I N K F V V L I S A T L V L S F A I
0	G F P G T P G L P G F
1	A P F P E
1	L E E L
0	N G G Y L A A G K L T W A D F
1	M A I P P K
1	A P G P A G P
0	G N R F L A P D D Q I K
1	T E
0	F L P A I V G A A A K F L P K I F C A I S K K C
1	L Q P E V M G
1	G P V A
0	V R T P E
1	Q P G
0	Y A Y V A R E Q S C R
1	W R H
1	M P V Q A
1	L L Q S
0	P T H I K W
0	Y Q E V L G P V R G P F P I I V
1	F R
0	M G G V A A L F G M P W L S A
0	A V R I G P C D Q V C P R I V P E R H E C C R A H G R S G Y A Y C S G G G M Y C N
0	G A T R D R P L W I I F S G N M N I K L
0	V R G P F P I I V
1	M C P V D P N I E
1	I P P L
0	T K F I L V L T G E E R Q G V
0	V D L L V N L L P A I L S P G A
0	F L P I V G R L I S G L L
0	R T E Q K D F D G R S E F A Y G S F V R
1	P V
0	A A P A N D K F T V F E A A F
1	E V T F P A
0	V R A L E E A N T E L E V K I
0	G I K C R F C C G C C T P G I C G V C C R F
0	L H E P G
0	Y V V K S F D R S T K V I D F H Y P N E
1	L I V T Q
0	T P E Q I K T L V E K L R Q T
0	E S S V D D R P M K T V S Q D
1	V W
0	G F G C P N N Y A C H Q H C K S I R G Y C G G Y C A G W F R L R C T C Y R C G
1	T H
1	G P A E
0	P L L C V G L R P Q W E
1	V G G S D L Q A L K
0	P S P A K P D P N L Y N T L D
1	T Y
0	A K C I K N G K G C R E D Q G P P F C C S G F C Y R Q V G W A R G Y C K N R
1	R H
1	P Y
1	W R P
0	D Q V F P M N P P K
1	I L E L A
0	K K R F M K L N I N V S L P Q T L S L K
0	A I S G S S L A H P Q R K I S
0	V C Y N Q
0	V N D V C N F A S R N D Y S Y W L S T P A
1	T P V V V P P F L Q P E V
0	L P V P Q
0	N T L Y S G H K D N L I R V W S I S D A E
0	G A I I G L M V G G V V I A
0	C D K K C I E W E K A Q
1	F P G P I P
1	N A N E E E Y
0	A T S L S P F Y L R P P S F L R
1	E T
1	E Y
0	N D Y S Y W L S I P A L M P M N M A P I
1	A P G
1	Y P S Y
1	W M H Q P H Q P L P P T
1	Y P F P G P I P N
0	M R K W F H N V L S S G Q L L A D K W P A W D Y N R K
0	M P R W R L F R R I D R V G K Q I K Q G I L R A G P A I A L V G D A R A V G
0	A L A S P G S C L E E F R A S P F L E C
0	C D V G S D W R F L R G Y H Q Y A Y D G K D
0	R M L G Q T P
1	A H
1	N L
1	M W P
0	Q N I P P
0	V Y I H P F
0	F L G A L F H A L S K L L
0	A S Y D T K F
1	F L
1	V P P F L Q P E V
1	E H
0	D T A N W S W P D G A E L P F T I
1	I T V D D K
0	T Q P K T N A I P Y
1	M K P V D P N I E
0	L T Q T P V V V P P F
1	W I Q P
0	L I K G R T P I K F G K A D C D R P P K
1	V L G P
0	F L F R V A S K V F P A L I G K F K K K
1	D N
1	M H Q P P Q P L
0	T K K T K L T E E E K N R L
0	F A D K P D E S T L S P E M K E H Y D K
0	K L G D K E M I Q H Y T L D Q
0	D V R I W P L D P S L L G E P
0	A Q G T L S K I F K L G G R D S R S G S P M A R R
0	Y F L L K W L G H P N V S
0	K H R D T S E P G A C V M I L Y F
1	G P G E
1	I H F
1	H D
0	M M E P M V K
1	D R
0	E P G E V L V E I E T D K A Q M D F
0	S S G K N E G T N I Y N N N E A F K V E
1	G A
1	P W
1	R N
1	Y P V E P F
1	M E
0	E E N V E H D A E E N V E H D A
0	G C F E D W S R C S P S T S R G T G V L W R D C D S Y C K V C F K A D R G E C F D S P S L N C P Q R L P N N K Q C R C I N A R T A K D N R N P T C W A
0	F K G V D A Q G T L S K I F K L G G R
1	M Y
0	Q G Y R V S S Y L P L L
0	M A S V E V E S A A T A L P K N E T P E
1	L L R
0	L F V V Y R D S I P H A A C H
0	K W C F R V C Y R G I C Y R R C R
0	G A P G P A G P G G I P G E R G
1	R P C F
1	V S
0	S L G I L G I K N L I A A A V P K L T I E
0	N M Y A M M I A R F K M F P E V K E K G
0	L L W L L L F L A I L I W M Y Y H G Q R
1	N V
0	A N N G N L Q L R N K E V T W E V L E G
0	G T V G G T K Y G L A K G V S L V A V K
1	L Q S W M H Q P H Q P L P P T V M F P P Q S V L
0	A Y C L W M M L L I S Q A E A A L E L I T
1	R K
0	G C A S R C K A K C A G R R C K G W A S A S F R G R C Y C K C F R C
1	I P P L T Q T P V V V P P F
0	V G I N Y W L A H K H K
0	D V Y A P G K D I T S L K P G G S T D T
1	W R I
1	V A P F P E V F G K
0	R Q M V Q A M R A I G T H P S S S
0	F L P L V T M L L G K L F
0	F P P Q S V L
0	A Y T G V
0	L E D L L M G T L G I V C P I C S Q K P
1	F V A P F P E V F G K
1	W M
1	L C S E K L D Q
1	M A
0	I R F S V R R F H P K L G D K
0	L E A K I T M L T N G Q C Q N I T
0	K A F D I T Y V R L K F
1	P G V G G P L G P I G P C Y G
1	P G
0	L G R S G G D I I K K M Q T L
1	N P
0	L K D T Q
0	T P E K E E P T A A P A E P E A P A P E
1	P P L T Q T P V
0	N F S G F T K G T D I A D L D A V A
1	D T Q A I V Q N N D
1	F A T G T
1	D V T F P A
1	G L Q L P F S E E
1	W Y
1	G W
1	V P P F I Q P E
1	E K
1	M W I V D P N I E
1	M T P V D P N I E
0	K D Q D K
0	F A Q T Q S
1	E W
0	G L F D I I K K I A E S I
1	V D A S L S L K P S F E E
0	F R G L A K L L K I G L K S F A R V L K K V L P K A A K A G K A L A K S M A D E N A I R Q Q N Q
0	G F G C P N N Y Q C H R H C K S I P G R C G G Y C G G W H R L P C T C Y R C G
0	D R K M Y W Q F K M D K I Q I
0	F L P F I A R L A A K V F P S I I C S V T K K C
0	L Y L K R K L I Y D A A V E G
0	Q T C S P L R V N H A V L A V G Y G T Q
1	V P I T P T L
1	Y M
1	I Q P
1	I I A P
1	L K G Y G G V S L P E
0	L V Y P F P G P I
1	H E
1	Q N
1	A D
0	G H F V K P E A F L P F S A G R R A C L
1	G I
1	V P P F L Q P E
0	G E P G I A G F K G A Q G P K G E P G P A
1	W R G
1	M I M
1	T W
1	P A C G G F Y I S G R P G
0	K C T E E D S G S N G K K I T C E C T K
0	G L F A V I K K V A S V I K G L
1	S V
1	G P K G D R G L P G P P G R D G M
0	G K K V L Q
0	F L G A L F K V A S K V L P S V K C A I T K K C
1	K E
1	W R E
1	H L
1	K L L L R R L Q
0	F T S L L Q H F S F S V P T G Q P R P S
0	I G M I F Q H F N L L S A K N V F E N V A
0	G P F P I I V
1	A L A V
0	Y E G E R A M T K D N N L L G
1	W V P V D P N I E
1	T A T G L L E
1	P P P P
0	T T E W V E T T A R E L P I P
0	V L D T D Y K
0	K Y P V E P F T E S Q S L T L T D V E N L H L
0	Q L G F L G P R
0	I Y F A A L S P A V T F G G L
1	Q Q
0	H P F A Q
1	V L P V P
1	G L V G P D A G K E M G
0	E K L I E T Y F S K N Y Q D Y E Y L I N V I
0	L A I P V N K P
0	K D E R F
1	A P
0	V K A G F
1	R P
1	L Y Q G P I V L N P W D Q V K
0	E V E R K H P L G G S R P G R C P T V P P G T F G H C A C L C T G D A S E P K G Q K C C S N
0	Y Y A P F E
1	W L A H K A L
0	V I P E L
1	V E P
0	Y K W L P
0	S L V Y P
1	E I
1	W G
1	Y P V E P F T E S Q
0	D Y S N T H S T R Y V
1	L P L P L L
1	I P A V F K
1	S H
0	I P S L E A A V K Q A Y A A T V A A A P Q
0	M T S R D I E V Q G F R I P K G T T L I
1	W R R
1	S L
1	W N
1	T A
0	G D A C G E T C F T G I C F T A G C S C N P W P T C T R N
1	V L G P V R G P F P
0	F R V P T P N
0	F L S L I P H A I N A V S A L A N H G
0	Y N R L E K V E A D A Q V D R L I T G R
0	H E A C Y D Q R E P Q A W C R P
1	N M
0	F V Q W F S K F L G R I L
0	K E A V P L E D L V L P E P V G
0	D G D F A I V K F T K V L L D Y T G H I
0	E V R R Y T A R L K E G D V F
1	A E
1	L V V Y P W T
0	G L P V C G E T C V G G T C N T P G C S C S W P V C T R N
0	C V L Y R Y G S F S V T L D I
1	G P
0	S Q S K V L P V P Q
0	G H K I A T F Q Q R
0	P T H D A W
0	F L P L I G K I L G T I L
0	N H L Y E T P I S A T A M V I
1	L P Y P Y
1	M V P V D P N I E
1	L P Q N I P P L T
0	A F P R S
0	I L P I L S L I G G L L G K
0	N L L R F
1	N A V P I T P T
0	G I G G K I L S G L K T A L K G A A K E L A S T Y L H
0	R K V L E N R S L S D E E R M
1	I P A V F K I D A L
1	N N
0	V A H I N V W K
0	L G H T V C L S G F M G I D L
1	F F V A P F P E V F
1	V K S V V A L
1	M G P V D P N I E
1	F Y P E L F
0	N V I Y S Q N S F L P R A T T
0	T P E V D D E A L E
1	F P G P I P N
0	D D M T M K P T P P P Q Y P L N L Q G G G G G G S G D G F G F A V Q G H Q K V W T S D N G R H E I G L N G G Y G Q H L G G P Y G N S E P S W K V G S T Y T Y R F P N F
0	I L R W P W W P W R R K
1	K Y
1	W R D
1	Q P Q
1	K K
0	P Y V R Y L
1	Y F
0	N T V Y F G F D K Y D I T G E
0	S T Y Q T
0	P C H I A W
1	V L
1	S P T V M F P P Q S V L
0	D A Y Y N Y L N N L V L A S Y N R
1	W W W
0	D G T Q Q F Y H Y A S S V K P A R V I F
0	R R V T E T R S S F S R V S G S P S S G F
0	G L I G L I G P P G E Q G E K
1	V H S P
0	G F K L K G M A R I S C L P N G Q W S N F P P K C I R E C A M V S S
1	L A
1	S I V L Q E Q S L Q
1	G P V
0	V A F N M F T D N V D Q
0	S F S V P T G Q P R P S H H G V F A F L
0	G R E N Y H G C T T H W G F T L C
1	M P F P K
1	E V
0	K Y Y A D S V K G R F T I S R
0	N K W K K I L G K I I K V V K
1	A M P V Q A V L P
1	E P V L G P V R G P F
1	F P
0	N E N L L R F F V A P F P E
1	T S G Y D T Q A I V
1	I P
1	Y E
1	K I
1	M A P V D P N I E
0	E L I H V L H G L Y G M Q V S S
0	L P P P V H
0	R P K H P
1	A A A A G
1	Y P F P G P I P D
0	I P L Y R N G D F F I S S K D
1	F Y
1	I L L P G A Q D G L
0	F G G I D D I N Q I G Q S D
0	G G L R S L G R K I L R A W K K Y G P I I V P I I R I G
1	A L P M H I R
1	E Q L T K C E V F R
0	H L M Q K I Q R D E D S Y E R D P Y S P
0	Q K F S E H F S I H C C P P F T F L N S K R
1	R E Y L L V A Q
1	V T
0	A L N E I N Q F Y Q K
1	Q T
1	W P
0	A Y P G N G V H C G K Y S C T V D K Q T A I G N I G N N A A
0	Q F H Q P L V S H Q M R L S Q
1	I A
0	E N A R I L K N C V D A K M T E E
0	V K E L Q
0	V E L W P
1	V P L G T Q Y
0	K N Q K K I R G I L E S L M C N E S
0	A K P E G
1	L H
0	H P F A Q T Q
0	G P G A G T P G G A
1	L A P S T M
1	S W
0	R E G D K H K L K K S E L K E L
0	G F G C N G P W D E D D M Q C H N H C K S I K G Y K G G Y C A K G G F V C K C Y
0	L N D A L S L R T E A R A T Y
0	K S C C K N T T G R N I Y N T C R F A G G S R E R C A K L S G C K I I S A S T C P S D Y P K
0	F A A Q K A K A N K A V D
1	G P F P I I
0	Y P V Q P F T E
0	I L M Q Y I K A N S K F I G I
0	A F K L L G R I I H H V G N F V Y G F S H V F
0	E F T N V S C T T S K E C W S V C Q R L H N T S R G K C M N K K C R C Y S
0	G G G Y I T C P P Y V E V C Q
1	N R
1	C A Y Q W Q R P V D R I R
0	N S T Y F P G K L R R V I G D
0	I E W E G
1	M I P V D P N I E
0	A D T L A C R Q S H Q S C S F V A C R A P S V D I G T C R G G K L K C C K W A P S S
0	P N R I K Y G D
1	Q Q R R L L R R K
0	Q F K R E L R N L P Q Q C G L R A P Q R
1	I V Y
0	L H L P L L
1	V Y P F P G P
1	I L
1	M W
1	L P Q N I P P
0	A H E P V K
1	G V
1	M I
1	W L
1	R G
0	P T F T I E T T T L P Q D A V S R T
0	S E F A Y G S F V R T V S L P V G A D E
0	K S D N Q I K A V P A S Q A L
1	P Q N I P P L
0	I P Q S L D S W W T S L
0	S K T S A S I G S L C A D A R M Y G V L P
1	P H
1	W R
1	D P
0	L I Y P F V E P I P
0	E N G D V K F D L I P K E N T E R S H K
0	D V A G I V G V P V A A G C T
1	M A P K H K E M P F P K Y P
1	A M A P K H K E M P F P K Y P V E P
1	V D T F P A
1	P T
0	I K P L N Y
0	R N P I L H F M R L K P K G L N N I
1	Q D
0	V V K D P Y K F L N K E K R D K F L
1	K P
1	Y Y
1	G P F P I L V
0	V K N V I G P F M K A V C V E
0	A K Y T G K C T K S K N E C K Y K N D A G K D T F I K C P K F D N K K C T K D N N K C T V D T Y N N A V D C D
1	T R
0	Y L V P Q L
0	E V L Y L K P L A G V Y R S L K K Q
0	A V V E S N G T L T L S H F G K C
0	M Q K Y M Q I V R Y L T I L I T L I
0	Y P S F Q P Q P L I Y P
1	I P P L T Q T P V V V P P F L Q P E
1	G P F P I I V
0	N G S A A P Q L T K N A G V L T C I L S
0	C I I H R G K P F Q L E A V F E A N Q N T K T A
0	A E V D C S R F P N A T D K
1	Q L
0	D A Y P S G A
1	F V Y P W
0	K M Q A M K L E K D N A M D R
0	G F G C P N D Y P C H R H C K S I P G R A G G Y C G G A H R L R C T C Y R
1	H P
0	A A E F P D F Y D S E E Q M G P H Q E A E D E K D R A D Q R V L T E E E K K E L E N L A A M D L E L Q K I A E K F S Q R
0	G R H S A E Y Y N K Q Y L E R T R A E L D T A
1	T K C E V F R E
1	L I V T Q T M K
1	P P L T Q
1	L S F
0	F W G A L A K G A L K L I P S L F S S F S K K D
0	P K Y V K Q N T L K L A T
0	Y T L D Q V N Q H K K A I E E
1	L L
0	G P P G P P
0	L K E L Q
0	V K K T C
1	H V
0	V P P I P P
1	L T L
1	L P I I D I
0	W V P S V
0	A Y K R Q
0	S T S L V K A H S M R N S A S
0	K F H S G I Q S E P K A I P
0	C T F T L P G G G G V C T L T S E C I C
1	P F
0	E R R A K E K L Q E Q Q R D L E Q R K A D T K K
1	L Q A L H Q G Q I V
0	G C I I T S L T G R D K N Q V E G E
1	Y P S Y G L N Y Y
0	P K K G S K K A V T K A Q K K D G K K R K R S R
1	I G V N Q E L A Y
1	F F
1	S P A Q I L Q W Q
0	Y Q E P V L G P V R G P F
0	V D S I T E V E C F L T P E M
0	V I C T T K Q Y T R R C L S K
0	V P R L P E Q G S S S R A E D S P E G
1	L H S M K
0	M S S D S A V A A L S A A M T S P Q K S
1	M D P V D P N I E
1	H P H P H
0	K L I A Y P I A V E A L S L
1	V P Q L E I V P N
0	D S H A K R H H G Y K R K F H E K H H S H R G Y R S N Y L Y D N
0	R A D H P F
0	R E K L Q L I L T L S R N A S L Y L N G A
0	L N V L R I I N E P T A A A I
1	W S
1	L V Y P F P G P I P N S L P Q N I P P
1	L N F L
0	F L P I I A S V A A K V F S K I F C A I S K K C
0	L E I V P K
0	G I N H E K Y N S S Q T I V S N A S
0	V I Y N I N S T I V R S M K D L M Q
0	D R T G V R V L T M C P G V T
1	T P
0	N I P P L T Q T P V
0	D E N S K Q K K W D P L K K E
1	S L P Q N I P P L T Q T P
1	E P
1	I P S K
1	Y Q
1	T F
0	E V K E K G M A A L P R L I A
1	G Q
1	P P F L Q
0	F G I N A E N N H R I F L A G
1	I I
0	A L A F Q
1	W H
0	P A I K A W V A K R P P T D L
1	T M
1	L T
0	E N F F K E I E R A G Q R I R D A I I S A A P A V E T L A Q A Q K I I K G G D
0	Y F S K A Y G V P S A Y I W E
0	K P Q E E K E K I T K E I L N G K
1	F L M E S H
1	P G V G G P L G P I G P C Y E
1	L V Y P F P G P I P N
0	F L K W L F K W A K K
0	G R L I P T C K N L R P G P S P K E F E
1	Q P F
1	A V P Y P Q R D M P
1	V P L
1	L P Q N I P P L T Q T
0	R A P R K T S E R S Q P R G R R Q P I P K A R R
1	I P A
0	L K L Y Q W I L K Q K S M A S E E I
0	A R D L P G Q
1	W W
0	T A T E L N N A L Q N L A R T I S E A G
0	D K I Y P S F Q P Q P L I Y P
1	G F
1	I H
1	I R
1	W K
1	I A V P T G V A
1	I L A P
0	Y Q E P V L Q P V R
0	D F K L F A V Y I K Y R
0	G Q W R G A A G T A A Q A A V V R F Q E
1	L P L
0	F Y P E L
0	L V Y P T S L G F P L K L V L
1	W E
1	E P V L G P V
0	A T P A T P T V A Q F V I Q G S T I C L V C
1	Q P H Q P L P P T
1	I P A V F
0	S A S V R I R Y K K M K V F C P R P
0	Y L A H K
1	N N A G V A K P
1	I W
1	L K P T P E G D L
0	R R P Q D V K F P G G G Q I V G G V Y
0	M P F H N I H P L T I G
0	F L G Y S I Y L N R K R R G D P A F K R R L R D
1	T L
1	F V A P F P E V F
0	A A N K Q K Q E L D E I S T N I R Q A G
1	E P V L G P V R G P F P I
0	Q R S R Q F Q N L Q N H R I V Q I E A K
0	L S V P D G L K V S N S S A R G
0	K C I E W E K A Q H G A
0	A L P K K L K Y L N L F N D G F N Y M G V V
1	P S
0	V L P I P
1	H K E M P F P K Y P
1	M R P V D P N I E
0	M D F L I
0	G A S R H W Y F L
0	L S F L P S D F F P S V R D L
0	D I Q I P G I K K P T H R D I I I P N W N P N V R T Q P W Q R F G G N K S
0	K F K G K A T L T S D K
0	P L G G G S Q T W E G S G V L P C V G T
0	A A P A E G E K P A E E E K P I T E A A
1	M V
0	S M A T G W L Q N N G S W Y Y
0	A Y F Y P E L
0	A P V P P
1	Y S
1	L N
0	K L V F F A E D V G S N K G A
1	Y P S K P D N P G E
0	F L P I V T N L L S G L L
1	I M
1	G Y
0	E P K A I P
1	P A
0	G R D Y R T C L T I V Q K L K K M V D K P T Q R S V S N A A T R V C R T G R S R W R D V C R N F M R R Y Q S R V T Q G L V A G E T A Q Q I C E D L R L C I P S T G P L
1	Y P F P G P
0	G K D F F K P L R I L L T G N S H G V E F
0	F K R L A K I K V L R L A K I K R
0	T G P I P N
0	K I H P F A Q A Q
1	L Y Q E P V L G P V R G P F P
1	V V
0	G I P C G E S C V F I P C I S S V I G C S C S S K V C Y R N
0	I C K I N V A V N I E P Q T Y
1	L S F M
1	M W P N G S S L G
0	F L S L I P H A I N A V S A I A K H F
0	I P P L T Q
0	E G E P R
0	V Q Y S R A D E E Q Q Q A L S S Q M G F
1	K H
0	E S Q I T T L I V S K P E R K
0	G T D G V T Y T N D C L L C
1	V P
1	L I V T Q T M K G L D I Q K V A G T W Y S L A M A A S D I S L L D
0	F A K L W A K L A K K L
0	L G L L K L V A Q R R N L L K Y I
0	L K D A Q
1	A W
1	V L D T D Y
1	W V
1	A A
0	A S G R D I A M A I G T L S G Q F V A G G I G A A A G G V A G G A I Y D Y A S T H K P N P A M S P S G L G G T I K Q K P E G I P S E A W N Y A A G R L C N W S P N N L S D V C L
1	M R
0	H T P G V H M A S L S V Y L K T N V F L
0	A P E A P A E Q P K P A P A P
0	R E L E E L
1	M G S F
1	L Y Q E P V L G P V R
1	P P G
1	L H L P L P
0	G E G A V Q W M N R L I A F A S R G N H V
0	I E M L F Y M K N L E R K K L Q S S
1	M H
1	D P F
1	E P V L G P V R G P F P I I
1	Y T
1	S P
1	T T A G L L E
1	G E
1	V G L
1	V Q
0	A V V P V L A Y A A A R L L L
1	L N E N L L R
1	S P G S S G P Q G F T G
0	F L P I A S L L G K Y L
1	V M
1	L L Y Q E P V L G P V R
1	A V
1	I D A L N E N K
0	Q S I A L S S L M V A Q A I P
1	L V Y P F P G P I P N S L P Q N I P P L T Q T P V V V P P F
0	Q A P G K G L E W V A V I S Y
1	L S F N P T
0	K Y D F D G V N R G T R G T S
0	S V F N V V N S S I G L I M V L S F L F L N
0	E A H V K I T K L S D L K A I D D K
0	I N Y N L K Q H E T F K R R V
1	L T F P G S A E D
0	G I P G E R G P V G P S G
0	L P Q N I P P L T Q T P V V V P P F L Q P E V M G V S K
1	Q E
1	S I
1	P P F L Q P E V
0	L M N S P E F H L V F G E C E G V K I Q
0	G R F D G T V E V K E G G F E
1	G P F P I
1	A M A P K H K E M P F P K Y P
1	L T E E E K
1	R A
1	G L
0	K K I I A E K T K I P A V F K
1	Q P L P P T V
1	L S Q S K V L P V P Q K
0	A I T A K L
1	M D I V D P N I E
0	W H H T F
0	I V G R P R H Q G
0	L C G S H L V E A L Y L V C G E R
0	D D T G H N F E N T G E A M
0	F R G L M H Y
0	F L L S Y G E K D F E D Y R F
0	P Q G P V P N T A L F S L V L
1	S L P Q N I P P
1	Q A
0	M C E S A S S K
1	L P V P
1	H A
0	V Y S L I R P N E N P A H K S Q L
1	I A D H F L
0	S N E I L R L K G L M N S I L A Q N S G Q S L E Q
1	V T G R F A G H P A A Q
1	M W V
1	E S
0	K E S W S Y I V E T P N P E N G T
1	K V S V V P S
0	A W L H P G A P K V F
0	V V Y P W T Q R F
0	A V T C N T V V S S L A P C V P F F A G S A A Q P T A A C C N G V R S L N S A A R T T P D R R T A C N C I K S S A S S I G L N Y N K A A K L P S R C T V N V T V P I S P S V N C A T
0	A T C D L L S G F G V G D S A C A A H C I A R R N R G G Y C N A K K V C V C R N
1	G G
0	G A D L D K I G L H S D S Q E
1	L T Q T P
1	L P
1	P I
0	N K W E D K R L L Y S Q A
1	T P E V D D E A L E K F
1	P P F L Q P E V M
0	R G L E R A
1	L H L P L P L
1	T Q M V D E E I M E K F R
0	I R R V T R V Y H N G I T G E T T T
1	V P G E I V E
1	I P G D P G P P G P P G P
0	L I D K V V K
0	L S G T S M A S P H V C G L G A Y L I G
1	G P M
1	Y N L K E R Y A A W
0	A H I I I
0	S I G W A Y Q Y A L S S D S K N L S D L K
1	I P A V F K I D A
1	T G
1	G Y G G V S L P E W
1	F T E S Q S
1	Y P
0	D N Q L Q N G I K R V K E F L
0	I V G R P R H
0	Q D V H K K L R E W L S K N V
1	S P Q
1	A F
0	P S K I K W G D
1	Y P F P G P I P
1	D L T F P A
0	A L L G A Q P L L V L G F S G
1	E P M I G V N Q E
0	A A V P V L A F D A A R L R L L E
0	D F H I N Q
0	L H L P L P
1	N H
0	A L Q Q I M E N Q S D R L Q G R Q Q E Q
0	G T L V R I A P V I G A C M A R Q A
0	K L Y K M A V A F M L A Y P Y
0	G I A Y F S M V G N W A K V L
1	Q H
0	H H P H G H H P H G H H P H G H H P H G
0	K Q K V A G P L C V R M D Q A I M
1	Y P Y Y
1	V K
1	R A S D P L L S V
